{
  "event_id": "22222222-2222-4222-8222-222222222222",
  "job_id": "11111111-1111-4111-8111-111111111111",
  "sequence": 7,
  "at": "2026-10-23T12:21:00Z",
  "type": "evidence",
  "stage": "retrieval",
  "message": "Evidence captured.",
  "evidence_id": "33333333-3333-4333-8333-333333333333",
  "progress_percent": 42
}
